165,P000165,AOC 24G2Z,"This could be just the thing you need for your gaming setup. You should never underestimate the importance of a proper setup with a monitor, keyboard, mouse and all the other peripherals since it can greatly improve the ergonomics of your battle station.  Response time: 1 ms  TN panel  Standardized VESA mount  23.8\"" screen  Aspect ratio: 16:9 (Wide) The screen size is 23.8 inches, which is a quite common screen size that should work well for most users. It has AMD Freesyncwhich means that the refresh rate of the monitor and graphics card synchronises. This model's panel is of the TN type. Thanks to the low response time with this panel type, it is very common in E-sports. When comparing different monitors, the most common thing is to look at response time and refresh rate. The response time is a more than ample 1 ms, well suited for gaming and it should make your games project smoothly. The refresh rate on this model is 240 Hz which is at the forefront when it comes to refresh rate. There are many great things to be said about this product. The current lowest price is £201.74, but make sure to compare a few merchants to get the best deal for you.",231.71,131.86,75.7,201.74,225.97,295.49,948,93,88,-5
166,P000166,LG 29WP500,"This could be just the thing you need for your home office setup. You should never underestimate the importance of a proper setup with a monitor, keyboard, mouse, and all the other peripherals since it can greatly improve the ergonomics of your home office.  IPS\u002FPLS panel  29-inch screen  Standardized VESA mount  AMD Freesync  Response time: 5 ms This model's screen size amounts to 29\",310.99,118.54,162.4,179.0,222.84,285.24,27,86,32,-54
167,P000167,Viewsonic XG2431,"The monitor is one of the very most important pieces of hardware when it comes to setting up a workspace at home or getting your gaming rig together. Computer performance can compensate for most things, but a sub-par picture is hard to live with.  IPS\u002FPLS panel  Made by Viewsonic  Standardized VESA mount  240 Hz refresh rate  16:9 (Wide) aspect ratio This model's panel is of the IPS\u002FPLS type, a rarely found type of panel among modern monitors. HDR gives a wider colour spectrum and a clearer definition between black and white. This product is highly popular on our site, and if you compare prices here on our site, you'll see that the current lowest price is £296.18.",325.67,192.32,69.3,296.18,325.87,394.79,491,87,14,-73
168,P000168,Brother MFC-L8690CDW,"Looking for a printer for your home office? Then this one might be just the thing since it's probably got all the features you'd need from a printer  Can make copies  Built-in scanner  Prints in colour  Wi-Fi connectivity Thanks to the built-in Wi-Fi connectivity, using this printer for wireless printing is as easy as it gets. This is a more compact printer, and because of that, it can hold quite a few sheets of paper (250 pieces). This, however, could be fully adequate if you print rarely. This printer currently has a lowest price of £369.90, which is below average for the category, which makes this printer a great purchase. This might be just the thing that your home office setup needs!",369.9,226.93,63.0,403.2,456.49,801.65,174,2,74,72
169,P000169,Canon Pixma TS3350,"Looking for a printer for your home office? Then this one might be just the thing since it's probably got all the features you'd need from a printer  Can make copies  Built-in scanner  Prints in colour  Wi-Fi connectivity Handily enough, this is a very versatile printer that you can use to scan documents as well as print them. It's quite nice not having to buy two separate machines. This is a more compact printer, and because of that, it can hold quite a few sheets of paper (60 pieces). This, however, could be fully adequate if you print rarely. This printer currently has a lowest price of £42.58, which is below average for the category, which makes this printer a great purchase. This might be just the thing that your home office setup needs!",65.39,26.61,145.7,42.58,51.38,69.99,714,29,45,16
170,P000170,Epson Workforce WF-7830DTWF,"Of course, depending on what kind of profession you have, a printer is a very useful and important part of your home office setup. And this printer might be just the thing you're looking for  Can make copies  Built-in scanner  Colour printer  Wi-Fi connectivity Not only can you print things with this printer, but you can also make copies. Truly a versatile machine that could come well in handy in your daily work life. AirPrint is Apple's own system for wireless printing, and this particular printer has built-in support for it, so users of Apple products could benefit a lot from that. This printer currently has a lowest price of £170.99, which is below average for the category, which makes this printer a great purchase. This might be just the thing that your home office setup needs!",170.99,121.27,41.0,178.48,233.99,333.62,115,75,97,22
171,P000171,Epson EcoTank ET-4856,"Of course, depending on what kind of profession you have, a printer is a very useful and important part of your home office setup. And this printer might be just the thing you're looking for  Can make copies  Built-in scanner  Colour printer  Wi-Fi connectivity Not only can you print things with this printer, but you can also make copies. Truly a versatile machine that could come well in handy in your daily work life. Most physical paperwork today is done on A4 paper, so it might not be a huge problem that this printer is limited to that print format. This printer currently has a lowest price of £359.99, which is below average for the category, which makes this printer a great purchase. This might be just the thing that your home office setup needs!",359.99,243.24,48.0,359.99,402.99,599.62,659,94,41,-53
172,P000172,Seagate IronWolf ST12000VN0008 12T,"This internal hard drive from Seagate might be able to replace your old storage unit. This model is a conventional hard drive built with rotating magnetic discs. This model's cache memory is 256 MB.  Classic hard drive  Cache memory: 256 MB  Internal hard drive  3.5\"" form factor  Size: 12 TB If you prioritize a higher storage capacity, then this HDD drive might be the thing for you. It is made to be mounted internally. The storage capacity is 12 TB and the size of the cache memory is 256. Thanks to temporary storage on the cache memory, writing data to this hard drive is faster. We're sure that you'll find this product to your satisfaction. The current lowest price is £130.00, but make sure to compare a few merchants to get the best deal for you.",130.0,82.8,57.0,139.0,279.82,358.56,248,35,51,16
173,P000173,Seagate Storage Expansion Card for Xbox Series X\u002FS 1T,"An external SSD drive fulfills many needs, among other things you can use it for making backups of your files or take your movies with you on your trip. To describe the physical size of the hard drive you use the term \""form factor\"". This particular model has a 2.5\"" form factor. It has room for 1 TB of data, which lets you store quite a bit of movies and pictures with no issue.  SSD for faster loading  Form factor: 2.5\""  1 TB storage space  External hard drive Do you prioritize maximum performance when you're looking for an external hard drive? This is an SSD drive, which trumps an HDD drive in terms of speed. It can store 1 TB and the form factor for this model is 2.5\"". One huge advantage of 2.5\"" drives is that they can be powered by a USB port, so no need for a power adapter. This product has gotten great reviews. The current lowest price is £143.00, but make sure to compare a few merchants to get the best deal for you.",260.0,87.2,198.2,143.0,233.45,296.64,436,52,57,5
174,P000174,Crucial X6 Portable SSD 4T,"A portable SSD drive gives you many options. It both works for making backups of your files or as extra storage when you're not at home. This model's capacity caps at 4,P000 GB, which is plenty of space for whichever files you want to save.  External hard drive  SSD unit  540 MB read speed  4,P000 GB storage space Crucial brings you this portable SSD. Since this storage unit has no moving parts, it's much less sensitive to bumps and vibrations. The storage space of this hard drive is 4,P000 GB and it uses an USB-C connection. In short, this product has a lot of things going for it and if you compare prices here on our site you'll see that the current lowest price is £168.99.",182.86,132.02,38.5,168.99,258.93,547.87,45,57,92,35
175,P000175,SanDisk BLACK SN850 NVMe SSD M.2 with Heatsink 1T,"If it's time to upgrade the storage on your portable computer, then you might want to check out this internal SSD drive. This is an SSD unit, and it's therefore both faster and more energy-efficient than regular HDD drives. How fast the hard drive can read and write files is measured with read and write speed, which for this model is 7,P000 MB and 5,300 MB, respectively.  Form factor: M.2  5,300 MB write speed  Stores 1 TB  Internal hard drive  7,P000 MB read speed Since SSD drives have no moving parts, it is quieter than an HDD drive. If this is a priority for you, then this model might be the thing for you. You can store up to 1 TB and the read and write speed is 7,P000 MB and 5,300 MB, respectively. In short, this product has a lot of things going for it and if you compare prices here on our site you'll see that the current lowest price is £89.99.",145.0,67.66,114.3,89.99,184.19,264.99,705,34,47,13
176,P000176,Western Digital Black SN850X NVMe SSD M.2 2T,"If you want to expand the internal storage of your laptop, then this model from Western Digital might be a good choice. Read and write speed for this SSD drive is 7,300 MB and 6,300 MB, respectively. The higher these numbers are, the faster the drive can read and write files. With an SSD unit completely free of moving parts you get a hard drive which is both energy-efficient and insensitive to vibrations.  6,300 MB write speed  M.2 form factor  Internal hard drive  7,300 MB read speed  2 TB storage space SSD has a low power consumption, which leads to very low heat development. This Western Digital SSD might be just the thing you're looking for. The storage capacity is 2 TB and it has an M.2 form factor. M.2 is a flexible form factor that can be connected to a wide array of interfaces, depending on what is supported by your motherboard. This product has gotten great reviews and if you compare prices here on our site you'll see that the current lowest price is £119.71.",136.0,78.24,73.8,119.71,161.66,352.79,730,40,61,21
177,P000177,LaCie Mobile Drive USB 3.0\u002FType-C 2T,"If the internal storage on your computer is running out, then an external hard drive is a perfect option for expanding the storage space. To describe the physical size of the hard drive you use the term \""form factor\"". This particular model has a 2.5\"" form factor. It has room for 2 TB of data, which lets you store quite a bit of movies and pictures with no issue.  Mechanical hard drive  Size: 2 TB  External hard drive  Form factor: 2.5\"" This external hard drive gives you a lot of storage for your money. Since an HDD drive is a bit more sensitive to vibrations, you have to be careful when moving it. It can store 2 TB and it uses an USB-C connection. There are many great things to be said about this product and if you compare prices here on our site you'll see that the current lowest price is £84.00.",115.7,62.22,86.0,84.0,119.83,136.8,560,43,21,-22
178,P000178,MSI GeForce GTX 1650 D6 Ventus XS OC HDMI DP 4G,"You need a computer with modern components to get the most out of your graphics card. It's not exactly as easy as going into the store and buying the first graphics card you see, you need to be doubly sure that it will meet your requirements.  Brand: MSI  4 GB memory  GeForce GTX 1650  Memory: GDDR6-type memory It can hardly be argued that Nvidia GeForce graphics cards are cheap, but they have a performance that could be said to rival most competitors. Furthermore, it has a 4 GB GDDR6 memory. MSI GeForce GTX 1650 D6 Ventus XS OC HDMI DP 4GB costs $144.99 and is a top-ranked graphics card in terms of popularity on PriceRunner. The price is below average for the category, which makes this graphics card a good purchase.",214.4,109.02,96.7,144.99,190.68,277.54,782,51,94,43
179,P000179,Palit Microsystems GeForce RTX 3060 Dual 12G,"If you play a lot of games, then your computer should have good components to match the requirements of the game. The number of products available on the market today is just staggering, and you should be able to find that that suits your needs.  12 GB memory  GPU clock speed: 1.32 GHz  Brand: Palit Microsystems  GeForce RTX 3060  Memory: GDDR6-type memory If you are looking for top-level performance, you can hardly go wrong with a Nvidia GeForce graphics card. They might not come cheap, but you'll hardly be lacking in performance. As for the clock speed, it amounts to 1.32 GHz. This card also lets you play VR games. If you compare prices on Palit Microsystems GeForce RTX 3060 Dual 12GB on PriceRunner, you will find that it currently costs $269.99. The price is below average for the category, which makes this graphics card a good purchase.",269.99,223.13,21.0,290.85,328.59,399.99,838,11,22,11
180,P000180,Radeon RX 6750 XT Dual OC HDMI 3xDP 12G,"The graphics card is the part of the computer that ensures that you can get all the way up to maximum resolution. There are plenty of graphics card to choose from, so make sure you do your research to determine which one is right for you.  12 GB memory  Radeon RX 6750 XT  Memory: GDDR6-type memory  2,532 MHz clock speed  Requires 2.7 slots If you are looking for top-level performance, you can hardly go wrong with an AMD Radeon graphics card. They might not come cheap, but you'll hardly be lacking in performance. It takes up 2.7 slots in your computer case and you therefore need to consider how much space you have in your computer case. This is a top-ranked graphics card in terms of popularity on PriceRunner at the moment and Radeon RX 6750 XT Dual OC HDMI 3xDP 12GB costs $331.54. The price is below average for the category, which makes this graphics card a good purchase.",389.91,263.13,48.2,331.54,376.33,459.99,595,26,54,28
181,P000181,Gigabyte GeForce RTX 4090 GAMING OC HDMI 3xDP 24G,"For those looking for gaming performance, then the graphics card is the most important component. The number of products available on the market today is just staggering, and you should be able to find that that suits your needs.  Brand: Gigabyte  Memory: GDDR6X-type memory  GeForce RTX 4090  24 GB memory If you are looking for top-level performance, you can hardly go wrong with a Nvidia GeForce graphics card. They might not come cheap, but you'll hardly be lacking in performance. The 24 GB GDDR6X memory works to ensure that everything runs smoothly. At the moment, the lowest price listed for Gigabyte GeForce RTX 4090 GAMING OC HDMI 3xDP 24GB here on PriceRunner is $1570.00. The price is above average for the category, which combined with all its features makes it a premium product.",1649.95,1082.76,52.4,1570.0,1729.99,2099.99,951,37,64,27
182,P000182,Palit Microsystems GeForce RTX 4080 GameRock HDMI 3xDP 16G,"If you want high resolution in your games, then that increases the demand on your graphics card. The number of products available on the market today is just staggering, and you should be able to find that that suits your needs.  Memory: Memory: GDDR6X  16 GB memory  Requires 3.5 slots  Manufactured by Palit Microsystems  GeForce RTX 4080 If you are looking for top-level performance, you can hardly go wrong with a Nvidia GeForce graphics card. They might not come cheap, but you'll hardly be lacking in performance. The 16 GB GDDR6X memory works to ensure that everything runs smoothly. It also has support for virtual reality games. If you compare prices on Palit Microsystems GeForce RTX 4080 GameRock HDMI 3xDP 16GB on PriceRunner, you will find that it currently costs $1050.00. The price is above average for the category, which combined with all its features makes it a premium product.",1050.0,820.31,28.0,1193.87,1240.28,1353.99,190,96,21,-75
183,P000183,ASUS TUF Gaming GeForce RTX 4070 Ti OC 2xHDMI 3xDP 12G,"If you want high resolution in your games, then that increases the demand on your graphics card. The number of products available on the market today is just staggering, and you should be able to find that that suits your needs.  12 GB memory  Brand: ASUS  Requires 3.25 slots  GeForce RTX 4070 Ti  Memory: GDDR6X-type memory If you are looking for top-level performance, you can hardly go wrong with a Nvidia GeForce graphics card. They might not come cheap, but you'll hardly be lacking in performance. It needs 3.25 slots to be mounted, so make sure you have room for that. At the moment, the lowest price listed for ASUS TUF Gaming GeForce RTX 4070 Ti OC 2xHDMI 3xDP 12GB here on PriceRunner is $844.99. The price is above average for the category, which combined with all its features makes it a premium product.",1016.41,555.91,82.8,844.99,885.94,1026.53,420,94,52,-42
184,P000184,MSI GeForce RTX 3060 Ti Ventus 3X OC HDMI LHR 3xDP 8G,"To maximise the performance of the graphics card, you should make sure your other components are equally powerful. There are plenty of graphics card to choose from, so make sure you do your research to determine which one is right for you.  8 GB memory  Memory: Memory: GDDR6  Brand: MSI If you feel you need to compromise on your ambition of getting an AMD Radeon or Nvidia GeForce because of the price, then this card might be something you want to consider. As for the memory, this has a GDDR6 memory clocking in at 8 GB. At the moment, the lowest price listed for MSI GeForce RTX 3060 Ti VENTUS 3X 8GD6X OC grafikkort here on PriceRunner is $335.62. The price is below average for the category, which makes this graphics card a good purchase.",349.98,231.46,51.2,335.62,360.99,429.99,506,69,64,-5
185,P000185,ASUS GeForce RTX 4060 Ti Dual OC Edition HDMI 3xDP 8G,"To maximise the performance of the graphics card, you should make sure your other components are equally powerful. The number of products available on the market today is just staggering, and you should be able to find that that suits your needs.  Manufactured by ASUS  Requires 2.5 slots  Memory: GDDR6X memory  8 GB memory  2.31 GHz clock speed Just because it's not an AMD Radeon or an Nvidia GeForce doesn't mean it's not good. If you happen to find this at a good price it could absolutely be a good alternative. It takes up 2.5 slots in your computer case and you therefore need to consider how much space you have in your computer case. This is a top-ranked graphics card in terms of popularity on PriceRunner at the moment and ASUS GeForce RTX 4060 Ti Dual OC Edition HDMI 3xDP 8GB costs £379.76. The price is below average for the category, which makes this graphics card a good purchase.",419.99,240.35,74.7,379.76,412.99,510.91,634,42,83,41
186,P000186,TP-Link Archer MR400,"You can hardly get away with not having a wireless network anymore. Apart from the obvious things such as your phone and computer, you probably also have a smart TV at home, and maybe some type of smart speaker. In other words, it's not wise to compromise on your home network.  Wi-Fi 5 (802.11ac)  Up to 1.32 Gbps  Dual band  Supports several security protocols For certain things, like gaming or work tasks that require a fast internet connection, a 5 GHz band will come in handy. Other family members who just casually browse the web should do fine with the 2.4 GHz band. The Wi-Fi standard supported on this router is Wi-Fi 5 (802.11ac). However, the supported Wi-Fi standard might not be overly important to the average person. This model is incredibly popular among our users and the current lowest price is £62.99.",110.84,45.64,142.9,62.99,114.41,189.5,698,33,42,9
187,P000187,ASUS RT-AX58,"A mesh system makes conventional Wi-Fi extenders feel like ancient technology. You should not underestimate how convenient it is to have full coverage no matter where in your home you are and that your device will seamlessly switch connection between the various units in the mesh system.  Wi-Fi 6 (802.11ax)  Up to 2.98 Gbps  Dual band  Supports several security protocols As for the number of LAN ports, there are four of them in this model. Handy if you have several devices that need to be connected with a cord. A dual-band system is great if you have several wirelessly connected devices in your home. You get one 2.4 GHz band and one 5 GHz band. The latter is particularly useful if you need a fast connection, for example when gaming. This model is incredibly popular among our users and you can get it today for £106.02.",118.43,91.4,29.6,106.02,121.34,161.95,287,100,4,-96
188,P000188,ASUS ZenWiFi AX Mini XD4 (2-pack),"If you live in an apartment or a smaller house, you might not need a mesh system. In larger homes, however, it is one of the best ways to get Wi-Fi coverage in every corner of your home.  Wi-Fi 6 (802.11ax)  Up to 1.2 Gbps  Dual band  Power over Ethernet You should consider that there is just one LAN port on this model. However, this doesn't have to be a problem since a lot of modern devices connect wirelessly. For certain things, like gaming or work tasks that require a fast internet connection, a 5 GHz band will come in handy. Other family members who just casually browse the web should do fine with the 2.4 GHz band. This is an incredibly popular model on PriceRunner and the current lowest price is £149.80.",204.99,122.79,66.9,149.8,198.67,279.36,581,57,42,-15
189,P000189,TP-Link Deco X20 (1-pack),"If you live in an apartment or a smaller house, you might not need a mesh system. In larger homes, however, it is one of the best ways to get Wi-Fi coverage in every corner of your home.  Wi-Fi 5 (802.11ac)  Up to 1.8 Gbps  Dual band  Supports several security protocols If you have more than one device that needs to be connected with a cable, this model with two LAN ports might suit you well. The wireless speed is, of course, something you should consider when looking to buy a mesh system. This model can achieve 1,800 Mbps (1.8 Gbps) at most. The average review score is very high (4.5 out of 5) and the current lowest price is £74.99.",104.99,68.17,54.0,74.99,97.44,135.1,789,22,54,32
190,P000190,Linksys Atlas Pro 6 MX5503 (3-pack),"A mesh system makes conventional Wi-Fi extenders feel like ancient technology. You should not underestimate how convenient it is to have full coverage no matter where in your home you are and that your device will seamlessly switch connection between the various units in the mesh system.  Wi-Fi 5 (802.11ac)  Up to 5.4 Gbps  Dual band  Supports several security protocols The wireless speed is, of course, something you should consider when looking to buy a mesh system. This model can achieve 5,400 Mbps (5.4 Gbps) at most. Which Wi-Fi standards that are supported might not be something the average person takes into consideration, but in this case, it's Wi-Fi 5 (802.11ac). This could be just the model you're looking for and you can get it today for £349.99.",365.27,239.72,52.4,349.99,469.38,593.99,573,97,21,-76
191,P000191,Synology RT6600AX,"You can hardly get away with not having a wireless network anymore. Apart from the obvious things such as your phone and computer, you probably also have a smart TV at home, and maybe some type of smart speaker. In other words, it's not wise to compromise on your home network.  Wi-Fi 6 (802.11ax)  Up to 4.8 Gbps  Dual band  Power over Ethernet For security reasons, it's important that your router supports some form of wireless security protocol. If nothing else, you do this to prevent outsiders from connecting to your network. This model has support for various security protocols, including WPA. A dual-band router is great if you have several wirelessly connected devices in your home. You get one 2.4 GHz band and one 5 GHz band. The latter is particularly useful if you need a fast connection, for example when gaming. This is an incredibly popular model on PriceRunner and the current lowest price is £274.67.",279.0,236.78,17.8,274.67,302.73,371.16,253,31,32,1
192,P000192,ASUS ZenWiFi AX XT9 (2-pack),"If you live in an apartment or a smaller house, you might not need a mesh system. In larger homes, however, it is one of the best ways to get Wi-Fi coverage in every corner of your home.  Wi-Fi 6 (802.11ax)  2.4 GHz band  Supports several security protocols  3 LAN ports This is a single-band system, which might not be entirely convenient if you for example have many devices that require a wireless connection. But if you have just a few devices, then the 2.4 GHz should do fine. The average review score is very high (4.4 out of 5) and you can get it today for £416.95.",469.99,283.64,65.7,416.95,459.99,562.69,732,100,93,-7
193,P000193,ASUS RT-AX86,"A mesh system makes conventional Wi-Fi extenders feel like ancient technology. You should not underestimate how convenient it is to have full coverage no matter where in your home you are and that your device will seamlessly switch connection between the various units in the mesh system.  Wi-Fi 6 (802.11ax)  Up to 5.7 Gbps  2.4 GHz band  Supports several security protocols One of the most important things (albeit not the only important one) with a mesh system is what wireless speeds you can achieve. In the case of ASUS ASUS RT-AX86U Pro, you can get up to 5.7 Gbps. This could be just the model you're looking for and as of today, the lowest price is £182.34.",267.99,162.8,64.6,182.34,285.65,353.32,326,18,88,70
