ID,0,1,2,3,4,5,6,7,8,9,10,11,12
0,product_id,name,description,own_price,cost,profit_rate_%,min_price,med_price,max_price,in_stock,sales_old,sales_new,sales_change
1,P000001,Apple iMac Retina 5K Core i5 3.3GHz 8GB 512GB Radeon Pro 5300 27,"iMac Retina 5K Core i5 3.3GHz 8GB 512GB Radeon Pro 5300 27"" is a gaming computer with great specs to be able to handle advanced games. The computer has an Intel Core i5 processor and the RAM amounts to 8 GB. The hard drive is the fastest one you can get in computers made for the general public. 8 GB of RAM The graphics card is a Radeon Pro 5300 The processor is an Intel Core i5 3 GHz processor speed 512 GB SSD drive This computer's computer's SSD drive has a storage space of 512 GB.. You also get 8 GB of RAM. If you buy new RAM, take care to check that the RAM fits your motherboard. To be able to run advanced software, you need a good graphics card. The graphics card that comes with this computer is a Radeon Pro 5300. This particular graphics card works well for simpler tasks such as reading emails and surfing the web. To execute all the calculations asked of it, a computer uses a processor and it is what determines how fast the computer works. This computer has an Intel Core i5 processor with a clock speed of 3.3 GHz. To elevate the performance, the processor has been equipped with six cores, which means that it can run several applications at once without much interference. There are many great things to be said about this product and if you compare prices here on our site you'll see that the current lowest price is £1069.00.",1099.0,797.76,37.8,1069.0,1447.0,1878.91,41,44,71,27
2,P000002,MSI Trident X Plus 9SE-614E,"This stationary tower-type is space-efficient even when placed on the floor because of its vertical configuration. The RAM amounts to 16 GB. The computer has an Intel Core i7 processor. You have both an HDD drive, with its advantage in storage size, and an SSD drive, which makes up for it in speed. RAM: 16 GB The graphics card is a GeForce RTX 2070 Super Intel Core i7 4 GHz clock speed 512 GB SSD drive and 1 TB HDD drive The graphics card is what powers your games and determines how they perform. You get a GeForce RTX 2070 Super graphics card with this computer. This particular graphics card is good for simpler tasks such as web browsing and reading emails. The processor is one of the most integral components in a computer, if you want a fast computer you should go for one with a powerful processor. The Intel Core i7 processor has a clock speed of 3.6GHz. It suits those who like to multitask and run several applications at once. To elevate the performance, the processor has been fitted with eight cores. To make the most of the multiple cores, your applications should have support for that. In this model, you have two types of hard drives, a conventional HDD and a fast SSD. It has a large storage space of 512 GB and 1 TB. You also get 16 GB of RAM. A larger RAM means that the computer is faster when multitasking. This product has received great reviews. The current lowest price is £1124.35, but make sure to compare a few merchants to get the best deal for you.",1124.35,730.1,54.0,,,,346,45,43,-2
3,P000003,Apple iMac (2021) - M1 OC 7C GPU 8GB 256GB 24 ,"Are you thinking about decorating a home office? If you know you'll be working from home a lot (or even full-time), a desktop might suit you just as well as a laptop. With the right keyboard and mouse, you can achieve a much more comfortable working position than with a laptop. 8 GB of RAM Apple M1 256 GB SSD drive Screen size: 24"" Memory is of the type DDR4 This is an eight-core processor. The applications you run must be adapted to run on several processor cores to benefit from this fully. The RAM memory is of the DDR4 type, a standard which was released in 2014. This is not the most recent generation of DDR memory (DDR5 was released in 2020), but depending on what you want to use your computer for, it could still cope well enough. This computer's SSD drive can store data amounting to 256 GB. The review average for this product is very high and if you compare prices here on our site you'll see that the current lowest price is £1137.98.",1379.0,812.84,69.7,1137.98,1399.0,1907.99,684,82,13,-69
4,P000004,Apple iMac (2021) - M1 OC 8C GPU 8GB 512GB 24 ,"Are you thinking about decorating a home office? If you know you'll be working from home a lot (or even full-time), a desktop might suit you just as well as a laptop. With the right keyboard and mouse, you can achieve a much more comfortable working position than with a laptop. RAM: 8 GB The processor is an Apple M1 Fast SSD drive Screen size: 24 inches Memory is of the type DDR4 This is an eight-core CPU. The applications you run must be adapted to run on several processor cores to benefit from this fully. You get a somewhat older DDR4 memory, rather than the current-gen DDR5. However, an older memory could be a bit cheaper, and it might do well enough depending on your needs. This model has an SSD drive, which is a newer type of hard drive compared to the traditional HDD drive. The hard drive has room for 512 GB of data. In short, this product has a lot of things going for it. The current lowest price is £1439.99, but make sure to compare a few merchants to get the best deal for you.",1749.0,1133.85,54.3,1439.99,1725.38,2371.68,862,22,84,62
5,P000005,ASUS Zen AiO A5200WFAK-BA109T,"The home computer is characterized by an integrated screen and computer in one unit, which creates a clean, streamlined feel in your workspace. The RAM amounts to 8 GB. The processor is an Intel Core i3. The hard drive is the fastest one you can get in computers made for the general public.  8 GB of RAM  The processor is an Intel Core i3  2.1 GHz clock speed  Fast SSD drive  21.5\"" screen To execute all the calculations asked of it, the computer uses a CPU and it is what determines how fast the computer works. The Intel Core i3 processor has a clock speed of 2.1GHz. It is a dual-core processor, which should to just fine for the everyday user. This computer's computer's SSD drive can store files amounting to 256 GB. You also get 8 GB of RAM. A larger RAM means that the computer is faster when multitasking. There are many great things to be said about this product and if you compare prices here on our site you'll see that the current lowest price is £449.00.",449.0,278.88,61.0,468.88,602.89,770.45,514,44,25,-19
6,P000006,Medion Erazer Engineer X31,"A tower computer is called that since it stands vertically on your desk or floor, as opposed to laying down horizontally. The Intel Core i5 processor in this computer is very high-end and the GeForce RTX 3060 Ti graphics card works well for everyday tasks. Medion have gone for a more expensive, but also much faster, hard drive in this one.  16 GB of RAM  The graphics card is a GeForce RTX 3060 Ti  Intel Core i5  Processor speed is 2.5 GHz  512 GB SSD drive With a SSD drive in your computer you get a fast boot-up time on your computer. The hard drive has room for 512 GB of data. You also get 16 GB of RAM. If you buy new RAM, take care to check that the RAM fits your motherboard. The CPU is one of the most integral parts of a computer and it is what determines how fast the computer operates. Medion Erazer Engineer X31 (1692549) has an Intel Core i5 processor with a clock speed of 2.5 GHz. This is a six-core CPU, which provides ample multitasking power. The GPU is what determines how your games or applications are perceived. If you're looking for high-end graphics, then a GeForce RTX 3060 Ti GPU might be something for you. We're sure that you'll find this product to your satisfaction and if you compare prices here on our site you'll see that the current lowest price is £905.96.",905.96,532.92,70.0,1049.0,,,774,46,16,-30
7,P000007,Lenovo ThinkCentre Neo 50s 11T0003J,"A tower computer is called that since it stands vertically on your desk or floor, as opposed to laying down horizontally. This computer has an Intel Core i5 processor and you get 8 GB of RAM. Booting up this computer will be done in no time thanks to the hard drive.  RAM: 8 GB  The graphics card is an UHD Graphics 730  Processor: Intel Core i5  2.5 GHz clock speed  Fast SSD drive This computer's computer's SSD drive can store data amounting to 256 GB. The internal memory (RAM) amounts to 8 GB. If you buy new RAM, make sure that you get the right type of memory for your motherboard. To perform all the calculations asked of it, the computer uses a processor and it is what determines how fast the computer works. This computer has an Intel Core i5 processor with a clock speed of 2.5 GHz. To elevate the performance, the processor has been equipped with six cores. To make the most of the multiple cores, your applications should have support for that. The GPU is what powers your games and determines how they are perceived. The graphics card that comes with this computer is an UHD Graphics 730. This is not quite a high-end graphics card and it might not handle more demanding applications that well. We're sure that you'll find this product to your satisfaction and if you compare prices here on our site you'll see that the current lowest price is £458.40.",652.99,352.62,85.2,458.4,599.99,853.57,157,19,94,75
8,P000008,Lenovo Legion T7 34IAZ7 90S2005H,"Are you thinking about decorating a home office? If you know you'll be working from home a lot (or even full-time), a desktop might suit you just as well as a laptop. With the right keyboard and mouse, you can achieve a much more comfortable working position than with a laptop. 32 GB of RAM The graphics card is a GeForce RTX 3080 Ti The processor is an Intel Core i7 Processor speed is 3.6 GHz Fast SSD drive The processor is one of the most integral components in a computer and it is what determines how fast the computer operates . The Intel Core i7 processor has a clock speed of 3.6GHz. It suits those who like to multitask and run several applications at once. This is a 12-core processor. To make the most of the multiple cores, your applications should have support for that. While there are some models of desktop computer that use an older type of DDR memory, such as DDR4, DDR3 or even DDR2 in some cases, this one has the most recent DDR5-type of RAM. This computer's SSD drive can store data amounting to 1 TB. In short, this product has a lot of things going for it. The current lowest price is £2196.22, but make sure to compare a few merchants to get the best deal for you.",2519.99,1591.46,58.3,2196.22,2781.14,3590.99,46,34,64,30
9,P000009,GAMING PC,"Are you thinking about decorating a home office? If you know you'll be working from home a lot (or even full-time), a desktop might suit you just as well as a laptop. With the right keyboard and mouse, you can achieve a much more comfortable working position than with a laptop. SSD drive Memory is of the type DDR4 Useful desktop computer The RAM memory is of the DDR4 type, a standard which was released in 2014. This is not the most recent generation of DDR memory (DDR5 was released in 2020), but depending on what you want to use your computer for, it could still cope well enough. In short, this product has a lot of things going for it. The current lowest price is £449.00, but make sure to compare a few merchants to get the best deal for you.",449.0,371.07,21.0,2102.57,,,521,65,51,-14
10,P000010,Apple MacBook Air (2020) M1 OC 7C GPU 8GB 256GB SSD 13,"Get the sleekest, technologically advanced, and faster MacBook with the Apple MacBook Air 2020. It comes with M1, a custom-made system on a chip that integrates CPU, GPU, Neural Engine, and much on a single chip taking the MacBook's capabilities to a whole new level. Now you can perform all your tasks seamlessly and much faster with Apple MacBook Air 2020, thanks to a unified memory and two times faster SSD.  Octa-core CPU, 3.5x faster than the previous generation  18-core GPU  Up to 18 hours of battery life  M1 – system on a chip   16-core Neural Engine, 9x faster  16GB unified memory  Magic keyboard  Touch ID  Two Thunderbolt ports  Retina Display MacBook Air 2020 is Apple’s thinnest, most light-weight, fan-less, 13.3-inch display MacBook. Its 8-core CPU enables you to perform intensive tasks like gaming and professional editing 3.5 times faster; while using a fraction of power.  The M1 chip is powered by macOS Big Sur, Apple’s latest most powerful software, running on their most advanced hardware. Together they enable enhanced performance, swift task performance, top-class security, privacy, and many more performance benefits.  With Retina display, images on the MacBook Air 2020 are closest to reality. Enjoy sharper text and vibrant colours with the MacBook Air. The True Tune technology automatically adjusts the white point to allow for a more natural viewing. Whereas the three built-in microphones let you get heard in your virtual meetings and family meet-ups. MacBook Air (2020) M1 OC 7C GPU 8GB 256GB SSD 13\"" costs £769.00. It has a great average review of 4.78 out of 5 and its components make it a great purchase.",1169.0,565.44,106.7,769.0,878.0,2081.23,857,63,5,-58
11,P000011,Apple MacBook Pro (2020) M1 OC 8C GPU 8GB 256GB SSD 13,"If you look at the design, there are not any major changes, as a matter of fact, you can argue that it lacks important updates. But with the new M1 chip, the Apple MacBook Pro (2020) is an excellent laptop in its own right, delivering incredible performance – a big improvement compared to Intel-backed processors that powered the Mac line up before this model. The 2020 edition is 2.8 times faster than its predecessors and 3 times quicker than Windows laptops.  Hard drive - 256GB SSD  Camera - 720p FaceTime HD  8GB Unified RAM  13.3-inch screen with Retina display  Eight-core Apple M1 chip  Integrated 8-core GPU The battery life on the Pro is nothing short of excellent – like it is on the MacBook Air. Apple has also stated that the M1 chip will improve the battery life of the laptop – adding twice as much life compared to Intel models. You can easily get ten hours on a single charge and will have to run heavy programs and watch videos in 4k to drain the battery in Eight hours. Right now MacBook Pro (2020) M1 OC 8C GPU 8GB 256GB SSD 13 has a lowest price of £795.00, as you can see here on PriceRunner. It has a high average review of 4.67 out of 5 and its components make it a great purchase.",1099.0,703.54,56.2,795.0,1199.0,1716.48,456,85,37,-48
12,P000012,Apple MacBook Air (2020) M1 OC 8C GPU 8GB 512GB SSD 13,"Do you want to maximise your work hours throughout the day? If you use a laptop, you can keep working even if you're on a bus or a train. Also, if you're working from home, you can work from literally whichever room you want without limitations.  Weighs only 1.3 kg, good for the frequent traveller  512 GB SSD drive  Nimble format with a 13.3\"" screen  8 GB RAM  macOS  Apple M1 processor Apple MacBook Air (2020) M1 OC 8C GPU 8GB 512GB SSD 13\"" is a computer with the macOS operative system. It has 8 GB of RAM. More RAM allows your computer to handle its tasks faster. The screen size on this laptop is 13.3 inches. It has an integrated and can't handle as demanding tasks as a dedicated graphics card can. It uses an SSD hard drive, which is significantly faster than an HDD drive. To elevate the performance, the processor has multiple cores. The applications that you run should be optimized to run on multiple cores. To perform all the calculations you ask for, the computer uses the CPU and it's what determines how fast a computer is. Apple MacBook Air (2020) M1 OC 8C GPU 8GB 512GB SSD 13\"" costs £905.00 and is a top-ranked computer as far as popularity goes on PriceRunner. It has a great average review of 4.8 out of 5, and its components make it a great purchase.",1203.0,786.96,52.9,905.0,1059.91,1287.36,632,16,10,-6
13,P000013,Apple MacBook Pro(2021) M1 Pro 10C CPU 16C GPU 16GB 1TB SSD 14,"Laptops might be less powerful than conventional desktop computers. However, they are unrivalled in the flexibility it gives you when using them. Their biggest selling point is, of course, that they're portable, which lets you work or play your games regardless of whether you are at home, on the bus or even out in a park.  1 TB SSD drive  Apple M1 Pro  Nimble design with a 14.2-inch screen  macOS  Ten-core processor  The laptop weighs 1.6 kg The computer from Apple runs on the operative system macOS. It has 16 GB of RAM. More RAM allows your computer to run more applications at the same time. To elevate the performance, the processor has multiple cores to handle a larger workload. The CPU is one of the most important components of your computer and it's what determines how fast a computer is. The computer has a 14.2-inch screen. The computer has an integrated. Integrated cards are often slower than dedicated ones since it has no memory of its own. It uses an SSD hard drive, which is significantly faster than an HDD drive. As of today, Apple MacBook Pro(2021) M1 Pro 10C CPU 16C GPU 16GB 1TB SSD 14\"" has a lowest price of £1887.97, as you can see here on PriceRunner. It has a high average review of 4.7 out of 5, and its specifications makes it a premium product.",1887.97,1172.65,61.0,1888.0,2222.27,4892.93,979,62,33,-29
14,P000014,Apple MacBook Pro (2021) M1 Pro 10C CPU 16C GPU 16GB 512GB SSD 16,"Laptops might be less powerful than conventional desktop computers. However, they are unrivalled in the flexibility it gives you when using them. Their biggest selling point is, of course, that they're portable, which lets you work or play your games regardless of whether you are at home, on the bus or even out in a park.  16.2-inch screen  16 GB RAM  512 GB SSD drive  10 processor cores  macOS  Apple M1 Pro The laptop from Apple comes with the operative system macOS. The RAM of this particular model amounts to 16 GB. If you replace your RAM, make sure that it's compatible with the motherboard. Thanks to the multi-core processor you can run several applications simultaneously without them interfering with each other. The processor is the part that performs all the operations we ask the computer to do and it's what determines how fast a computer is. The computer's screen measures 16.2 inches. It has an integrated and is therefore often slower than a dedicated one, since it has no memory of its own. The fast SSD drive facilitates quick boot-ups, especially compared to models with HDD drives. Apple MacBook Pro (2021) M1 Pro 10C CPU 16C GPU 16GB 512GB SSD 16\"" costs £1645.00. It has a high average review of 4.7 out of 5, and its specifications makes it a premium product.",1694.95,1034.59,63.8,1645.0,2099.0,2665.56,602,59,1,-58
15,P000015,Apple MacBook Air (2022) M2 OC 8C GPU 8GB 256GB SSD 13.6,"Do you want to maximise your work hours throughout the day? If you use a laptop, you can keep working even if you're on a bus or a train. Also, if you're working from home, you can work from literally whichever room you want without limitations.  Compact design with a 13.6\"" screen  Apple M2  Octa-core processor  Weighs a nimble 1.2 kg  256 GB SSD drive  macOS Apple MacBook Air (2022) M2 OC 8C GPU 8GB 256GB SSD 13.6\"" is a computer with the macOS operative system. This model has 8 GB of RAM. If you're buying new RAM, make sure it fits your motherboard. The screen size on this computer is 13.6\"". The computer has an integrated. An integrated card can't handle as demanding tasks and a dedicated card can. It uses an SSD hard drive, which is significantly faster than an HDD drive. To elevate the performance, the processor has multiple cores, which makes running multiple applications smooth. The processor is one of the most important components of your computer, if you want a fast computer you need a powerful processor. Apple MacBook Air (2022) M2 OC 8C GPU 8GB 256GB SSD 13.6\"" costs £474.93. It has a great average review of 4.8 out of 5, and its components make it a great purchase.",474.93,389.29,22.0,1059.97,1135.24,1297.16,127,23,18,-5
16,P000016,Apple MacBook Air (2022) M2 OC 10C GPU 8GB 512GB SSD 13.6,"Do you want to maximise your work hours throughout the day? If you use a laptop, you can keep working even if you're on a bus or a train. Also, if you're working from home, you can work from literally whichever room you want without limitations.  Nimble design with a 13.6-inch screen  8 GB RAM  Weighs just 1.2 kg  Apple M2 processor  macOS  512 GB SSD drive The computer from Apple runs on the operative system macOS. It has 8 GB of RAM. More RAM allows your computer to run more applications at the same time. Thanks to the multi-core processor you can smoothly run several applications at the same time. To perform all the operations you ask for, the computer uses the CPU and it's what determines how fast a computer is. The computer has a 13.6-inch screen. The computer has an integrated. An integrated card can't handle as demanding tasks and a dedicated card can. The internal storage is a 512 GB SSD drive. If you compare prices on Apple MacBook Air (2022) M2 OC 10C GPU 8GB 512GB SSD 13.6\"" on PriceRunner you will see that it currently costs £1319.97. It has a high average review of 4.8 out of 5, and its specifications makes it a premium product.",1319.97,942.84,40.0,1319.97,1444.3,1809.71,623,52,26,-26
17,P000017,Apple MacBook Pro (2022) M2 OC 10C GPU 8GB 256GB SSD 13.3,"One drawback of laptops is that they tend to be quite expensive if you want one that has performance that even remotely resembles what you get in a desktop computer. However, there's no denying that they're incredibly handy and flexible to use due to the fact that they're portable.  Apple M2 processor  8 GB RAM  13.3-inch screen with a 2560x1600 resolution  256 GB SSD drive  macOS  Weighs only 1.4 kg, good for the frequent traveller Apple MacBook Pro (2022) M2 OC 10C GPU 8GB 256GB SSD 13.3\"" is a computer with the macOS operative system. It has 8 GB of RAM. More RAM allows your computer to run more applications at the same time. The screen size on this laptop is 13.3\"". It has an integrated and can't handle as demanding tasks as a dedicated graphics card can. The fast SSD drive facilitates quick boot-ups, especially compared to models with HDD drives. To elevate the performance, the processor has multiple cores, which makes running multiple applications smooth. To perform all the operations you ask for, the computer uses the processor and it's what determines how fast a computer is. If you compare prices on Apple MacBook Pro (2022) M2 OC 10C GPU 8GB 256GB SSD 13.3\"" on PriceRunner you will see that it currently costs £1038.80. It has a great average review of 4.7 out of 5, and its components make it a great purchase.",1169.95,649.25,80.2,1038.8,1255.76,1428.67,133,53,38,-15
18,P000018,Apple MacBook Pro (2022) M2 OC 10C GPU 8GB 512GB SSD 13.3,"Do you want to maximise your work hours throughout the day? If you use a laptop, you can keep working even if you're on a bus or a train. Also, if you're working from home, you can work from literally whichever room you want without limitations.  8 GB RAM  Octa-core processor  Weighs just 1.4 kg, good for the frequent traveller  macOS  13.3-inch screen with a 2560x1600 resolution  512 GB SSD drive The computer from Apple comes with the operative system macOS. The RAM of this particular model amounts to 8 GB. If you're buying new RAM, make sure it fits your motherboard. The screen size is 13.3 inches. The computer has an integrated. An integrated card can't handle as demanding tasks and a dedicated card can. The fast SSD drive facilitates quick boot-ups, especially compared to models with HDD drives. To elevate the performance, the processor has multiple cores, which makes running multiple applications smooth. To perform all the operations you ask for, the computer uses the processor. A more powerful CPU makes the computer faster. Apple MacBook Pro (2022) M2 OC 10C GPU 8GB 512GB SSD 13.3\"" costs £1099.00. It has a high average review of 4.7 out of 5, and its components make it a great purchase.",1411.2,773.94,82.3,1099.0,1449.0,1789.16,956,39,90,51
19,P000019,Lenovo Legion 5 15ARH7H 82RD0004,"Make sure you buy a laptop that matches your needs and what you're using the computer for. This computer has a dedicated graphics card, a GeForce RTX 3070. This means that the graphics card is a component of its own and therefore performs better than integrated ones. This computer has an octa-core AMD Ryzen 7 processor with a speed of 3.2 GHz.  512 GB SSD drive  The laptop weighs 2.4 kg  AMD Ryzen 7 processor  Windows  Eight processor cores  Dedicated GeForce RTX 3070 graphics card Lenovo Legion 5 15ARH7H 82RD0004UK is a laptop with the Windows operative system. It has 16 GB of RAM. If you replace your RAM, make sure that it's compatible with the motherboard. The clock speed in this processor, an octa-core AMD Ryzen 7, is 3.2 GHz. Thanks to the multi-core processor you can smoothly run several applications at the same time. The CPU is the component that performs all the calculations we ask the computer to do and it's what determines how fast a computer is. The screen size on this laptop is 15.6\"". The computer has a dedicated GeForce RTX 3070 graphics card. Dedicated graphics cards gives better graphics compared to an integrated one. The internal hard drive is a 512 GB SSD drive. Lenovo Legion 5 15ARH7H 82RD0004UK costs £1199.99 and is one of the most popular computers on PriceRunner. The performance combined with the price, which is above average for the category, makes this computer a premium product.",1299.99,805.36,61.4,1199.99,1583.63,3049.22,752,8,73,65
