250,P000250,TP-Link Deco X50 (3-Pack),"A mesh system is a whole other way to build a home network compared to a conventional router. If you have a larger home where the network coverage is a bit so-so in certain places, then a mesh system is the way to go.  Wi-Fi 6 (802.11ax)  Up to 3 Gbps  2.4 GHz band  Supports several security protocols It's worth noting that this system only has one frequency band at 2.4 GHz. Unless you have a lot of wirelessly connected devices, you should do fine. This model is incredibly popular among our users and you can get it today for £244.98.",306.2,167.79,82.5,244.98,282.29,435.8,205,12,71,59
251,P000251,JBL Link Portab,"With JBL Link Portable from JBL, you get a voice-controlled speaker that plays music and can answer your questions. JBL Link Portable has rechargeable batteries. Just make sure that they're charged, and you can stream music whenever you want. With a Bluetooth speaker, your music is never far away, and your phone becomes a convenient remote.  Bluetooth for easy connection  Water-resistant  Playback time is 8 hours  Bluetooth speaker A portable and voice-controlled streaming speaker. Ask the speaker to play one of your favourite songs or ask about the weather. More and more manufacturers in home electronics are adding voice control to their products. With this wireless speaker, you can connect and stream music from your phone, for example. You can access any music or podcast you have on your device. All in all, JBL Link Portable is a speaker with great features. JBL Link Portable costs 65.95 and is one of the most popular speakers here on PriceRunner. The price is below average for this category, which makes this speaker a good purchase. If this speaker has the features you need, you'll surely be satisfied with it.",65.95,50.73,30.0,108.33,,129.99,319,82,18,-64
252,P000252,Google Home M,"Home Mini is a voice-controlled speaker that will happily answer your questions and play the music you request. Your voice works fully as a remote. Whether it's a podcast or music you want to listen to, you easily connect to the speaker with Bluetooth and you use your phone as a remote. There are no batteries to be charged. Just plug in the speaker and it's good to go.  Connects with Bluetooth  Streaming speaker  Clever, portable speaker  Available in grey and black  Active speaker  Voice-controlled A portable and voice-controlled streaming speaker. The built-in microphone lets it hear your voice commands. More and more manufacturers in home electronics are adding voice control to their products. It has never been easier to access tons of music or podcasts. Connect this wireless speaker to your phone or tablet and start streaming. All in all, Home Mini is a speaker with great features. If you compare prices on Home Mini on PriceRunner you will see that it at the moment costs £20.10. The speaker has a great average review score of 4.47 out of 5, and its features make it a great purchase.",39.14,11.82,231.1,20.1,38.89,55.0,800,79,70,-9
253,P000253,Apple EarPods 3.5mm,"Apple EarPods 3.5mm are a perfect choice if you love to listen to music. They have a 1.4 metre cord and a built-in microphone lets you make phone calls as well.   Passive noise cancelling  In-ear design  Built-in microphone for your phone calls  Built-in buttons for volume control  1.4 metre cord with a 3.5 mm connector  Open acoustic seal The lower impedance (resistance) means that these headphones can be connected to your phone or other portable devices without the use of an amplifier. The headphones weigh no more than 10 grams, so they're very nimble. No problem carrying this around!  With the built-in microphone you can also use these headphones for phone calls. The in-ear design means that the buds sit comfortably in your ear and the compact size makes them handy to carry with you.  This is a popular product with a current lowest price of £3.25. It has multiple built-in features, which makes it a very useful model. Get a whole new sound experience with these awesome headphones from Apple.",12.0,5.94,102.0,9.98,21.45,40.19,172,35,88,53
254,P000254,Jabra Evolve 65 SE S,"These headphones are a perfect choice if you love to listen to music. They connect wirelessly via Bluetooth and the battery lasts for 10 hours.   On-ear design  Connects wirelessly  10 hours of battery life per charge  Built-in microphone for your phone calls  Built-in buttons for volume control  Closed acoustic seal To connect with a 3.5 mm connector doesn't get much easier, you just connect them to your device. The wired connection also gives you high sound quality. These headphones have a battery life of 10 hours and will probably last through your day without charging.  Integrated controls for the volume lets you lower or raise the volume with the push of a button, instead of having to take out your phone. These headphones have a closed acoustic seal, which isolates you from your surroundings and produces no sound leakage. Perfect if you want to enjoy your music in peace.  This is a popular product with a current lowest price of £89.95. It has several built-in features, which makes it a very useful model. Get a whole new sound experience with these awesome headphones from Jabra.",119.99,88.03,36.3,118.84,172.58,624.99,430,64,13,-51
255,P000255,Apple EarPods Lightning,"EarPods Lightning from Apple is a good choice for those looking for a great sound experience. They have a 1.2 metre cord and has a built-in microphone, so they work for hands-free phone calls.   Passive noise cancelling  In-ear design  Built-in microphone for phone calls  Built-in buttons for volume control  1.2 metre cord With some really good headphones, workouts becomes a lot more fun. Integrated controls for the volume lets you lower or raise the volume with the push of a button, instead of having to use the buttons on your phone.  The in-ear design means that the buds sit comfortably in your ear and the compact size makes them easy to carry with you. With the built-in microphone you can also use these headphones for phone calls.  This is a popular product with a current lowest price of £4.85. It has a high average grade of 4.25 out 5, which combined with its features makes it a good purchase. Life is too short to experience music through bad headphones.",13.59,8.66,56.9,9.96,19.99,40.19,723,18,50,32
256,P000256,Beats Solo3 W,"These headphones from Beats by Dr. Dre are a perfect choice if you love to listen to music. They connect cord-free via Bluetooth and have active noise cancelling for a complete musical experience.   Active noise cancelling  On-ear design  Connects wirelessly  40 hours of battery life per charge  Built-in microphone for your phone calls  Built-in buttons for volume control To connect with a 3.5 mm connector doesn't get much easier, you just connect them to your device. The wired connection also gives you very good sound quality. This model has a great battery life of 40 hours, so you won't have to charge it all too often.  Integrated controls for the volume lets you lower or raise the volume with the push of a button, instead of having to use the buttons on your phone. They weigh 215 grams, so they're not the lightest headphones on the market, but you can also take that as them being robust and solid.  This is a popular product with a current lowest price of £129.00. It has a high review average of 4.30 out 5, which combined with its features makes it a good purchase. These headphones from Beats by Dr. Dre can bring you a whole new sound experience.",140.7,104.88,34.2,129.0,199.95,308.4,189,53,59,6
257,P000257,Beats Studio3 W,"These headphones are a perfect choice if you love to listen to music. They connect cord-free via Bluetooth and the active noise cancelling gives you a complete musical experience.   Active noise cancelling  Over-ear design  Connects wirelessly  40 hours of battery life  Built-in microphone for phone calls  Built-in volume control This model has a great battery life of 40 hours, so you won't have to charge it all too often. Over-ear headphones are often larger than other types but have more hardware and often better sound quality.  With some really good headphones, workouts becomes a lot more fun. They weigh 260 grams, so they're not the lightest headphones on the market, but you can also take that as them being robust and solid.  This is a popular product with a current lowest price of £139.99. It has a high review average of 4.49 out 5, which combined with its features makes it a good purchase. Life is too short to experience music through bad headphones.",218.0,111.1,96.2,139.99,344.48,398.39,368,34,14,-20
258,P000258,Apple AirPods (2nd generation) 2019,"The Apple AirPods are premium wireless earbuds equipped with the renowned H1 chip to reduce latency, increase battery life and almost instantly pair to your devices. They’ll even filter out background noise when you use them to call! If you’re looking for top-quality wireless earbuds, consider the 2019 Apple AirPods with a charging case.   Renowned Apple H1 chip  Supplied with charging case  Reduce background noise on calls  Pair with Siri  Automated playing and pausing  AirPods are the flagship product in the Bluetooth earbud category, providing quality sound quality through the H1 chip. Through this chip, you benefit from reduced audio latency, improved battery life and it makes pairing to devices quick and easy. The H1 chip also supports Siri, so you always have a digital assistant in your ear when needed.  The 2019 Apple AirPods come with a self-charging case. Every time you put your AirPods into the sleek and protective case, your AirPods automatically start charging. And if you are ever worried about the remaining battery life of your AirPods, you can always ask Siri for an update on your real-time battery life.  Got to take a call on the go in a busy area? The Apple AirPods make your important calls clear by automatically filtering background noise and locking in on your voice. Stay connected to family and friends without audio problems, and maintain professionalism for business calls on the go with these wireless earbuds. This is a popular product with a current lowest price of £80.00. It has a high review average of 4.78 out of 5, which combined with its features makes it a good purchase. These headphones from Apple can bring you a whole new sound experience.",104.99,86.09,22.0,99.0,129.0,167.31,75,50,60,10
259,P000259,Sennheiser HD 400S,"Sennheiser HD 400S is just the thing you need to listen to your favourite podcast. They have a 1.4 metre cord and have active noise cancelling for a complete musical experience.   Active noise cancelling  Over-ear design  Built-in microphone for phone calls  Built-in buttons for volume control  1.4 metre cord with a 3.5 mm connector  Closed acoustic seal Over-ear headphones are not as compact as other types but have more hardware and often better sound quality. An integrated microphone makes this model very practical, since it can be used for phone calls, for example.  The lower impedance (resistance) means that these headphones can be connected to your phone or other portable devices without the use of an amplifier. Integrated controls for the volume lets you lower or raise the volume with the push of a button, instead of having to use the buttons on your phone.  This is a popular product with a current lowest price of £39.99. It has a high average grade of 4.08 out 5, which combined with its features makes it a good purchase. Life is too short to experience music through bad headphones.",39.99,31.24,28.0,41.89,60.0,69.95,3,53,5,-48
260,P000260,Beats Powerb,"Beats by Dre Powerbeats Pro are lightweight in-ear wireless earbuds offering a tailored fit through an adjustable hook. They’re manufactured with the renowned Apple H1 chip for seamless device pairing, Siri enabling and reduced sound latency. Experience first-class sound quality while working out, commuting or when taking calls with these earbuds.   Adjustable hook  Apple H1 chip equipped  Sweat-resistant   Siri enabled  Provided with self-charging case There’s no such thing as a pair of Beats by Dre Powerbeats Pro that doesn’t fit. With the adjustable hook, you can add these wireless earbuds to your ears with a completely tailored fit. Go running, cycling or hit the gym and be sure they won't fall out as you work up a sweat. They’re even sweat-resistant to make them even more perfect for all your workouts.  Dr Dre Powerbeats Pro earbuds are equipped with the Apple H1 chip. This built-in technology makes pairing to devices seamless with reduced latency and increased battery life. You’ll be able to control your earbuds with your fingertips and enjoy using them for as long as nine hours in one go. When they’re out of juice, add them to your self-charging case! The H1 chip allows users of these Bluetooth earbuds to connect to Siri assistant. Ask all your questions, get updates on traffic and much more with a personal virtual assistant in your earbuds. The earbuds will even block out background noise when speaking with Siri and any caller. This is a popular product with a current lowest price of £149.00. It has a high average grade of 4.32 out of 5, which combined with its features makes it a good purchase. These headphones can bring you a whole new sound experience.",169.99,122.13,39.2,149.0,238.53,360.0,685,22,8,-14
261,P000261,Apple AirPods Pro (1st generation),"Upgrade your wireless earbud game with Apple AirPods Pro, the pinnacle of Bluetooth earbuds. The Apple AirPods Pro use noise cancellation technology to provide excellent sound quality, so you can get lost in the music or take business calls in busy places. And they come with a compact self-charging case for added convenience!   Noise cancellation technology  Provided with self-charging case  Transparency mode to zone out  Water and sweat-resistant   Siri enabled  The Apple AirPods Pro are some of the best wireless earbuds on the market, if not the very best. This is in part thanks to the exceptional noise cancellation technology that blocks out background noise when listening to your playlist or taking calls. And if you need to zone out to place your coffee order, simply tap into transparency mode! These Apple AirPods are Siri enabled, meaning you can engage Siri with your questions whenever you need support. You can even ask Siri how much battery your AirPods have left, and if it's low, simply put them back into your self-charging carry case and they will automatically start charging.  Apple AirPods Pro are sweat-resistant. If you want to immerse into your music playlist with pristine sound quality while working up a sweat in the gym, the Apple AirPods are the go-to wireless earbuds. You’ll be able to run, row or pump iron without discomfort and without the worry that the earbuds will become damaged or fall out. This is a popular product with a current lowest price of £75.00. It has a high review average of 4.57 out of 5, which combined with its features makes it a good purchase. Life is too short to experience music through bad headphones.",100.0,80.65,24.0,179.0,199.99,249.74,690,35,27,-8
262,P000262,Sennheiser HD 450BT,"Sennheiser HD 450BT is a good choice for those looking for a great sound experience. They plug in with a cord for highest possible audio quality and Active noise cancelling filters out any disturbing background noise.   Active noise cancelling  Over-ear design  Connects wirelessly  Built-in microphone for phone calls  Simple design  Closed acoustic seal This model lacks built-in buttons to adjust the volume. This is, however, easily done on your computer or phone. These headphones have a closed acoustic seal, which isolates you from your surroundings and produces no sound leakage. Perfect if you want to enjoy your music in peace.  An integrated microphone makes this model very practical, since it can be used for phone calls, for example. Active noise cancelling means that the headphones can block all background noise that can disrupt your sound experience.  This is a popular product with a current lowest price of £94.99. It has a very good review average of 4.1 out of 5, which means other buyers have been very pleased with the product. These headphones can bring you a whole new sound experience.",149.99,89.28,68.0,99.99,129.99,199.95,64,60,43,-17
263,P000263,Jabra Evolve2 65-USB-A MS S,"These headphones from Jabra are a perfect choice if you love to listen to music. They connect cord-free via Bluetooth and the battery lasts for 37 hours.   Passive noise cancelling  On-ear design  Connects wirelessly  37 hours of battery life  Built-in microphone for your phone calls  Built-in buttons for volume control The headphones weigh just 176 grams, so they're very nimble. No problem carrying this around! The wireless range is 30 metres, so there's no problem if you're not right next to your phone or computer.  An integrated microphone makes this model very practical, since it can be used for phone calls, for example. To connect with a 3.5 mm connector is quick and easy, you just plug them into your device. The wired connection also gives you high sound quality.  This is a popular product with a current lowest price of £138.70. It has a high average grade of 4.03 out 5, which combined with its features makes it a good purchase. These headphones can bring you a whole new sound experience.",170.85,102.74,66.3,138.7,170.25,235.17,412,14,44,30
264,P000264,Skullcandy Crusher EVO,"Crusher EVO is a good choice for those looking for a great sound experience. They connect cord-free via Bluetooth and have a battery life of 40 hours.   Over-ear design  Connects wirelessly  40 hours of battery life per charge  Built-in microphone for your phone calls  Built-in buttons for volume control  Weighs 806 grams With the built-in microphone you can also use these headphones for phone calls. Over-ear headphones are not as compact as other types but have more hardware and often better sound quality.  Integrated controls for the volume lets you lower or raise the volume with the push of a button, instead of having to take out your phone. They weigh 806 grams, so they're not the lightest headphones on the market, but you can also take that as them being robust and solid.  This is a popular product with a current lowest price of £132.00. It has a high average grade of 4.55 out 5, which combined with its features makes it a good purchase. Life is too short to experience music through bad headphones.",168.99,110.92,52.4,132.0,169.99,339.35,832,65,8,-57
265,P000265,Sony Pulse 3D Wireless (PS5),"This model by Sony is a gaming headset is just what your inner gaming needs. It is easily connected cord-free and has a practical design. Put on this headset and go questing with your friends!  Passive noise cancelling  Connects wirelessly  12 hours of battery life  Built-in microphone for voice calls  Over-ear design Integrated buttons for the volume lets you lower or raise the volume with the push of a button, instead of having to use your computer for that. With a really good gaming headset, gaming becomes a lot more fun.  To connect with a 3.5 mm connector doesn't get much easier, you just connect it to your device. The wired connection also gives you very good sound quality. This headset has a battery life of 12 hours and will probably last through your gaming night without charging.  This is a popular product with a current lowest price of £67.99. It has several built-in features, which makes it a very useful model. With a good headset, your gaming nights is a whole new experience.",100.85,43.03,134.4,67.99,83.99,139.0,487,10,97,87
266,P000266,Apple AirPods Max,"AirPods Max from Apple is a good choice for those looking for a great sound experience. They connect cord-free via Bluetooth and have active noise cancelling for a complete musical experience.   Active noise cancelling  Over-ear design  Connects wirelessly  20 hours of battery life  Built-in microphone for phone calls  Built-in volume control Integrated buttons for the volume lets you lower or raise the volume with the push of a button, instead of having to use the buttons on your phone. With some really good headphones, workouts becomes a lot more fun.  With the built-in microphone you can also use these headphones for phone calls. Over-ear headphones are not as compact as other types but have more hardware and often better sound quality.  This is a popular product with a current lowest price of £321.00. It has a high average grade of 4.50 out 5, which combined with its features makes it a good purchase. These headphones from Apple can bring you a whole new sound experience.",543.0,289.19,87.8,321.0,549.0,735.84,56,90,37,-53
267,P000267,Skullcandy Jib T,"These headphones are a perfect choice if you love to listen to music. They connect wirelessly via Bluetooth and the battery lasts for 22 hours.   In-ear design  Connects wirelessly  22 hours of battery life per charge  Built-in microphone for your phone calls  Built-in volume control  Water resistant Integrated buttons for the volume lets you lower or raise the volume with the push of a button, instead of having to use the buttons on your phone. The lower impedance (resistance) means that these headphones can be connected to your phone or other portable devices without the use of an amplifier.  To connect with a 3.5 mm connector is quick and easy, you just plug them into your device. The wired connection also gives you very good sound quality. With the built-in microphone you can also use these headphones for phone calls.  This is a product with a current lowest price of £15.99. It has a range of built-in features, which makes it a very useful model. These headphones can bring you a whole new sound experience.",18.95,9.63,96.8,15.99,20.95,46.49,652,56,49,-7
268,P000268,Bang & Olufsen Beoplay HX,"These headphones from Bang & Olufsen is just the thing you need to listen to your favorite podcast. They connect cord-free via Bluetooth and Active noise cancelling gives you a complete musical experience.   Active noise cancelling  Over-ear design  Connects wirelessly  40 hours of battery life per charge  Built-in microphone for your phone calls  Built-in volume control They weigh 285 grams, so they're not the lightest headphones on the market, but you can also take that as them being robust and solid. With some really good headphones, workouts becomes a lot more fun.  A built-in microphone makes this model very practical, since it can be used for phone calls, for example. Over-ear headphones are often larger than other types but have more hardware and often better sound quality.  This is a popular product with a current lowest price of £275.00. It has several built-in features, which makes it a very useful model. These headphones from Bang & Olufsen can bring you a whole new sound experience.",279.95,187.07,49.6,275.0,449.0,722.24,624,57,88,31
269,P000269,Beats S,"These headphones from Beats are a perfect choice if you love to listen to music. They plug in with a cord for highest possible audio quality and the active noise cancelling gives you a complete musical experience.   Active noise cancelling  In-ear design  Connects wirelessly  Built-in microphone for phone calls  Simple design  Water resistant To connect with a 3.5 mm connector doesn't get much easier, you just plug them into your device. The wired connection also gives you very good sound quality. The in-ear design means that the buds fit very well in your ear and the compact size makes them handy to carry with you.  These headphones are water resistant and can handle some moisture. And there's no worry if you get a bit sweaty when you're working out. This model lacks built-in buttons to adjust the volume. This is, however, easily done on your computer or phone.  This is a popular product with a current lowest price of £88.90. It has a high review average of 4.4 out of 5, which combined with its features makes it a good purchase. Life is too short to experience music through bad headphones.",107.72,52.6,104.8,88.9,159.97,248.4,448,66,12,-54
270,P000270,Sennheiser CX True W,"These headphones are a perfect choice if you love to listen to music. They plug in with a cord for highest possible audio quality and Active noise cancelling gives you a complete musical experience.   Active noise cancelling  True wireless design  Connects wirelessly  Built-in microphone for phone calls  Simple design  Water resistant This model lacks built-in buttons to adjust the volume. This is, however, easily done on your computer or phone. These headphones have a closed acoustic seal, which isolates you from your surroundings and produces no sound leakage. Perfect if you want to enjoy your music in peace.  The in-ear design means that the buds sit comfortably in your ear and the compact size makes them handy to carry with you. Active noise cancelling means that the headphones can filter out all background noise that can disrupt your sound experience.  This is a popular product with a current lowest price of £69.99. It has a high review average of 4.1 out of 5, which combined with its features makes it a good purchase. Life is too short to experience music through bad headphones.",99.99,46.05,117.1,69.99,91.04,125.0,625,61,16,-45
